{
  "name": "startvibe-cc-marketplace",
  "version": "1.0.0",
  "description": "StartVibe Claude Code 插件市场配置项目 - 提供开发工具配置和 Marketplace 基础设施",
  "author": {
    "name": "Jianan",
    "email": "startvibe@linlaoshi.top"
  },
  "license": "MIT",
  "engines": {
    "claude": ">=1.0.0",
    "node": ">=18.0.0"
  },
  "keywords": [
    "claude-code",
    "marketplace",
    "development",
    "configuration",
    "eslint",
    "prettier",
    "husky",
    "pnpm",
    "plugin-infrastructure"
  ],
  "repository": {
    "type": "git",
    "url": "https://github.com/startvibe/startvibe-cc-marketplace"
  },
  "homepage": "https://github.com/startvibe/startvibe-cc-marketplace#readme",
  "bugs": {
    "url": "https://github.com/startvibe/startvibe-cc-marketplace/issues"
  },
  "main": "index.js"
}
