{
  "name": "notify",
  "version": "2.0.0",
  "description": "Cross-platform system notifications for Claude Code events using @startvibe/node-notifier-cli",
  "author": {
    "name": "Jianan",
    "email": "startvibe@linlaoshi.top"
  },
  "license": "Apache-2.0",
  "keywords": ["notification", "system", "utility", "cross-platform", "node-notifier-cli", "notify", "toast", "alert"]
}
